{
  "tournamentId": "lpl-2026-regional-finals",
  "updatedAt": "2026-10-25T03:00:07+08:00",
  "source": "https://lpl.qq.com/web201612/data/LOL_MATCH2_MATCH_HOMEPAGE_BMATCH_LIST.js",
  "matches": [
    {
      "id": "13506",
      "gameId": "237",
      "tournamentId": "lpl-2026-regional-finals",
      "startTime": "2026-09-17 17:00:00",
      "left": "TES",
      "right": "IG",
      "leftLogo": "https://img.crawler.qq.com/lolwebvideo/20240920155538/5beb948638f00bcda68fc4942e3f0a51/0",
      "rightLogo": "https://img.crawler.qq.com/lolwebvideo/20230103152918/562affbb9f99b0e472644f93a19291e7/0",
      "status": "finished",
      "matchType": "BO5",
      "stage": "资格赛",
      "phase": "第一天",
      "group": "",
      "leftScore": 3,
      "rightScore": 1,
      "scoreUpdatedAt": "2026-09-17T14:50:52.687Z",
      "finishedAt": "2026-09-17T14:50:52.687Z",
      "liveUrl": "https://lpl.qq.com/web202301/video_detail.shtml?nid=81283",
      "detailUrl": "https://lpl.qq.com/web202301/video_detail.shtml?nid=81283"
    },
    {
      "id": "13507",
      "gameId": "237",
      "tournamentId": "lpl-2026-regional-finals",
      "startTime": "2026-09-18 17:00:00",
      "left": "WE",
      "right": "JDG",
      "leftLogo": "https://img.crawler.qq.com/lolwebvideo/20230103153050/5c22150153baa973f73adf4909a041ec/0",
      "rightLogo": "https://img.crawler.qq.com/lolwebvideo/20230921143554/1e5189e914e40bfe18045bccbfc7ef82/0",
      "status": "finished",
      "matchType": "BO5",
      "stage": "资格赛",
      "phase": "第二天",
      "group": "",
      "leftScore": 1,
      "rightScore": 3,
      "scoreUpdatedAt": "2026-09-18T15:02:13.771Z",
      "finishedAt": "2026-09-18T15:02:13.771Z",
      "liveUrl": "https://lpl.qq.com/web202301/video_detail.shtml?nid=81369",
      "detailUrl": "https://lpl.qq.com/web202301/video_detail.shtml?nid=81369"
    },
    {
      "id": "13508",
      "gameId": "237",
      "tournamentId": "lpl-2026-regional-finals",
      "startTime": "2026-09-19 17:00:00",
      "left": "IG",
      "right": "JDG",
      "leftLogo": "https://img.crawler.qq.com/lolwebvideo/20230103152918/562affbb9f99b0e472644f93a19291e7/0",
      "rightLogo": "https://img.crawler.qq.com/lolwebvideo/20230921143554/1e5189e914e40bfe18045bccbfc7ef82/0",
      "status": "finished",
      "matchType": "BO5",
      "stage": "资格赛",
      "phase": "第三天",
      "group": "",
      "leftScore": 3,
      "rightScore": 1,
      "scoreUpdatedAt": "2026-09-27T01:04:05.690Z",
      "finishedAt": "2026-09-27T01:04:05.690Z",
      "liveUrl": "https://lpl.qq.com/web202301/video_detail.shtml?nid=81406",
      "detailUrl": "https://lpl.qq.com/web202301/video_detail.shtml?nid=81406"
    }
  ]
}
